{
  "character_id": "dona_chie",
  "canon_refs": [
    "data/narrative/canon_v3.json",
    "data/narrative/character_bible_v1.json#dona_chie"
  ],
  "master_status": "PENDING",
  "palette_signature": {
    "colors": [
      "#505030",
      "#303010",
      "#F0D0D0",
      "#101010",
      "#503010",
      "#F0D0B0",
      "#301010",
      "#D0D0B0"
    ],
    "notes": "Sampled proposal; no pixel palette normalization."
  },
  "silhouette_signature": {
    "reference_asset": "assets/candidates/characters/identity_v1/atlas08.png",
    "body_ratio_notes": "pequena e firme"
  },
  "asymmetry_contract": {
    "horizontal_mirror_safe": false,
    "notes": "Use authored right-facing view only. Review patches, props, knee support, towel and grips before authoring left."
  },
  "variants": {
    "gi": {
      "turnaround": null,
      "front_combat_pose": null,
      "back_view": null,
      "side_view": null
    },
    "nogi": {
      "turnaround": null,
      "front_combat_pose": null,
      "back_view": null,
      "side_view": null
    }
  },
  "human_reviewer": null,
  "rights_status": "PENDING",
  "shipping": false
}
