{
  "character_id": "cassio_molho",
  "canon_refs": [
    "data/narrative/canon_v3.json",
    "data/narrative/character_bible_v1.json#cassio_molho",
    "data/combat/roster_v3.json#cassio_molho"
  ],
  "master_status": "PENDING",
  "palette_signature": {
    "colors": [
      "#303030",
      "#101010",
      "#B05010",
      "#301010",
      "#B03010",
      "#903010",
      "#B05030",
      "#703010"
    ],
    "notes": "Sampled proposal; no pixel palette normalization."
  },
  "silhouette_signature": {
    "reference_asset": "assets/candidates/characters/identity_v1/atlas02.png",
    "body_ratio_notes": "carismatica, aberta, dominante em palco"
  },
  "asymmetry_contract": {
    "horizontal_mirror_safe": false,
    "notes": "Use authored right-facing view only. Review patches, props, knee support, towel and grips before authoring left."
  },
  "variants": {
    "gi": {
      "turnaround": null,
      "front_combat_pose": null,
      "back_view": null,
      "side_view": null
    },
    "nogi": {
      "turnaround": null,
      "front_combat_pose": null,
      "back_view": null,
      "side_view": null
    }
  },
  "human_reviewer": null,
  "rights_status": "PENDING",
  "shipping": false
}
