{
  "character_id": "mestre_quirino",
  "canon_refs": [
    "data/narrative/canon_v3.json",
    "data/narrative/character_bible_v1.json#mestre_quirino"
  ],
  "master_status": "PENDING",
  "palette_signature": {
    "colors": [
      "#303050",
      "#907030",
      "#905030",
      "#B07030",
      "#101010",
      "#503010",
      "#101030",
      "#705030"
    ],
    "notes": "Sampled proposal; no pixel palette normalization."
  },
  "silhouette_signature": {
    "reference_asset": "assets/candidates/characters/identity_v1/atlas08.png",
    "body_ratio_notes": "ritmada e ereta"
  },
  "asymmetry_contract": {
    "horizontal_mirror_safe": false,
    "notes": "Use authored right-facing view only. Review patches, props, knee support, towel and grips before authoring left."
  },
  "variants": {
    "gi": {
      "turnaround": null,
      "front_combat_pose": null,
      "back_view": null,
      "side_view": null
    },
    "nogi": {
      "turnaround": null,
      "front_combat_pose": null,
      "back_view": null,
      "side_view": null
    }
  },
  "human_reviewer": null,
  "rights_status": "PENDING",
  "shipping": false
}
