{
  "character_id": "pedro_bala",
  "canon_refs": [
    "data/narrative/canon_v3.json",
    "data/narrative/narrative_v3_fixes_characters.json#pedro_bala"
  ],
  "master_status": "PENDING",
  "palette_signature": {
    "colors": [
      "#101010",
      "#303030",
      "#B05030",
      "#103070",
      "#303070",
      "#103050",
      "#703010",
      "#B07030"
    ],
    "notes": "Sampled proposal; no pixel palette normalization."
  },
  "silhouette_signature": {
    "reference_asset": "assets/candidates/characters/identity_v1/atlas06.png",
    "body_ratio_notes": "magro, firme"
  },
  "asymmetry_contract": {
    "horizontal_mirror_safe": false,
    "notes": "Use authored right-facing view only. Review patches, props, knee support, towel and grips before authoring left."
  },
  "variants": {
    "gi": {
      "turnaround": null,
      "front_combat_pose": null,
      "back_view": null,
      "side_view": null
    },
    "nogi": {
      "turnaround": null,
      "front_combat_pose": null,
      "back_view": null,
      "side_view": null
    }
  },
  "human_reviewer": null,
  "rights_status": "PENDING",
  "shipping": false
}
