{
  "character_id": "oni_da_lapa",
  "canon_refs": [
    "data/narrative/canon_v3.json",
    "data/narrative/character_bible_v1.json#oni_da_lapa",
    "data/combat/roster_v3.json#oni_da_lapa"
  ],
  "master_status": "PENDING",
  "palette_signature": {
    "colors": [
      "#101010",
      "#303030",
      "#703010",
      "#905030",
      "#503010",
      "#301010",
      "#501010",
      "#905010"
    ],
    "notes": "Sampled proposal; no pixel palette normalization."
  },
  "silhouette_signature": {
    "reference_asset": "assets/candidates/characters/identity_v1/atlas01.png",
    "body_ratio_notes": "muito pesada"
  },
  "asymmetry_contract": {
    "horizontal_mirror_safe": false,
    "notes": "Use authored right-facing view only. Review patches, props, knee support, towel and grips before authoring left."
  },
  "variants": {
    "gi": {
      "turnaround": null,
      "front_combat_pose": null,
      "back_view": null,
      "side_view": null
    },
    "nogi": {
      "turnaround": "assets/candidates/characters/identity_v1/atlas01.png",
      "front_combat_pose": null,
      "back_view": "assets/candidates/characters/identity_v1/atlas01.png",
      "side_view": "assets/candidates/characters/identity_v1/atlas01.png"
    }
  },
  "human_reviewer": null,
  "rights_status": "PENDING",
  "shipping": false
}
