{
  "character_id": "kenzo_kuroi",
  "canon_refs": [
    "data/narrative/canon_v3.json",
    "data/narrative/character_bible_v1.json#kenzo_kuroi",
    "data/combat/roster_v3.json#kenzo_kuroi"
  ],
  "master_status": "PENDING",
  "palette_signature": {
    "colors": [
      "#303030",
      "#101010",
      "#303050",
      "#101030",
      "#301030",
      "#D09050",
      "#F09050",
      "#D07030"
    ],
    "notes": "Sampled proposal; no pixel palette normalization."
  },
  "silhouette_signature": {
    "reference_asset": "assets/candidates/characters/identity_v1/atlas02.png",
    "body_ratio_notes": "longa, precisa, pouca gesticulacao"
  },
  "asymmetry_contract": {
    "horizontal_mirror_safe": false,
    "notes": "Use authored right-facing view only. Review patches, props, knee support, towel and grips before authoring left."
  },
  "variants": {
    "gi": {
      "turnaround": "assets/candidates/characters/identity_v1/atlas02.png",
      "front_combat_pose": null,
      "back_view": "assets/candidates/characters/identity_v1/atlas02.png",
      "side_view": "assets/candidates/characters/identity_v1/atlas02.png"
    },
    "nogi": {
      "turnaround": null,
      "front_combat_pose": null,
      "back_view": null,
      "side_view": null
    }
  },
  "human_reviewer": null,
  "rights_status": "PENDING",
  "shipping": false
}
