{
  "character_id": "byaku",
  "canon_refs": [
    "data/narrative/canon_v3.json",
    "data/narrative/character_bible_v1.json#byaku",
    "data/combat/roster_v3.json#byaku"
  ],
  "master_status": "PENDING",
  "palette_signature": {
    "colors": [
      "#F09050",
      "#F0D0D0",
      "#303030",
      "#101010",
      "#D0D0D0",
      "#303050",
      "#D07030",
      "#F0B050"
    ],
    "notes": "Sampled proposal; no pixel palette normalization."
  },
  "silhouette_signature": {
    "reference_asset": "assets/candidates/characters/identity_v1/atlas04.png",
    "body_ratio_notes": "seca, felina, base aberta"
  },
  "asymmetry_contract": {
    "horizontal_mirror_safe": false,
    "notes": "Use authored right-facing view only. Review patches, props, knee support, towel and grips before authoring left."
  },
  "variants": {
    "gi": {
      "turnaround": null,
      "front_combat_pose": null,
      "back_view": null,
      "side_view": null
    },
    "nogi": {
      "turnaround": "assets/candidates/characters/identity_v1/atlas04.png",
      "front_combat_pose": null,
      "back_view": "assets/candidates/characters/identity_v1/atlas04.png",
      "side_view": "assets/candidates/characters/identity_v1/atlas04.png"
    }
  },
  "human_reviewer": null,
  "rights_status": "PENDING",
  "shipping": false
}
